{
  "type": "gas_reading",
  "version": "0.2",
  "stamp": "2026-10-10T05:12:33.120Z",
  "device_id": "mob_01",
  "h2s_ppm": 0.021,
  "nh3_ppm": 0.83,
  "tvoc_ppb": 240.0,
  "temperature_c": 23.1,
  "humidity_pct": 58.4,
  "pump_on": false,
  "payload_voltage": null,
  "eco2_ppm": 520.0,
  "voc_index": null,
  "nox_index": null,
  "pressure_hpa": 1008.4,
  "gas_resistance_ohm": 52300.0,
  "pm1_0_ugm3": null,
  "pm2_5_ugm3": null,
  "pm10_ugm3": null,
  "nh3_raw": 0.7,
  "h2s_raw": 0.02,
  "flags": 1024
}
